{
  "artifact_type": "pptx-manifest",
  "artifact_version": "1",
  "artifact_id": "pptx-manifest:composition:maintenance-shift",
  "composition_ref": {
    "artifact_id": "composition:maintenance-shift",
    "artifact_version": "2"
  },
  "plan_ref": {
    "artifact_id": "plan:pptx:composition:maintenance-shift",
    "artifact_version": "2"
  },
  "package": {
    "path": "deck.pptx",
    "sha256": "sha256:a50d73a154456f5c22322edb6da9e07dbe7319bda50d89966794fd68791b9bce"
  },
  "slide_size": {
    "unit": "emu",
    "cx": 12192000,
    "cy": 6858000
  },
  "writer": {
    "name": "cogni-publishing/design-render",
    "version": "0.0.29",
    "adapter": "scripts/pptx_adapter.py"
  },
  "runtime": {
    "name": "cpython",
    "version": "3.14.2"
  },
  "design_system": {
    "name": "editorial",
    "version": "0.0.16"
  },
  "theme": {
    "slug": "editorial",
    "tokens_sha256": "sha256:ad17141b0648f3e1b5d4ef8880c0e60b74fad09715ef341932a2ea956df700b5"
  },
  "language": "en-US",
  "fonts": [
    {
      "token": "typography.font-heading",
      "requested_stack": [
        "Playfair Display Bold",
        "Georgia Bold",
        "Cambria",
        "serif"
      ],
      "requested_family": "Playfair Display Bold",
      "resolved_face": "serif",
      "substituted": true,
      "skipped": [
        "Playfair Display Bold",
        "Georgia Bold",
        "Cambria"
      ],
      "fallback_chain": [
        "serif"
      ],
      "source": "generic",
      "typeface": "Times New Roman"
    },
    {
      "token": "typography.font-mono",
      "requested_stack": [
        "IBM Plex Mono",
        "Consolas",
        "monospace"
      ],
      "requested_family": "IBM Plex Mono",
      "resolved_face": "monospace",
      "substituted": true,
      "skipped": [
        "IBM Plex Mono",
        "Consolas"
      ],
      "fallback_chain": [
        "monospace"
      ],
      "source": "generic",
      "typeface": "Courier New"
    },
    {
      "token": "typography.font-sans",
      "requested_stack": [
        "Source Serif 4",
        "Georgia",
        "Cambria",
        "serif"
      ],
      "requested_family": "Source Serif 4",
      "resolved_face": "serif",
      "substituted": true,
      "skipped": [
        "Source Serif 4",
        "Georgia",
        "Cambria"
      ],
      "fallback_chain": [
        "serif"
      ],
      "source": "generic",
      "typeface": "Times New Roman"
    }
  ],
  "readability": {
    "min_sz": 1050,
    "token": "typography.size-small",
    "autofit": "none"
  },
  "assets": [
    {
      "part": "ppt/embeddings/Microsoft_Excel_Worksheet1.xlsx",
      "sha256": "sha256:101db7077c78af8f85835cf05855a3f15170041c555639a32f08b1535949cf21",
      "kind": "chart-workbook",
      "unit": "u-components"
    }
  ],
  "slides": [
    {
      "index": 1,
      "part": "ppt/slides/slide1.xml",
      "name": "document",
      "unit": null,
      "pattern": null,
      "notes_part": null,
      "notes_paragraphs": 0,
      "objects": [
        {
          "shape_id": 2,
          "name": "copy:document#title",
          "kind": "text",
          "editable": true,
          "capability": "text-frame",
          "copy_keys": [
            "document#title"
          ],
          "fallback": null
        }
      ]
    },
    {
      "index": 2,
      "part": "ppt/slides/slide2.xml",
      "name": "u-answer",
      "unit": "u-answer",
      "pattern": "answer-emphasis",
      "notes_part": "ppt/notesSlides/notesSlide1.xml",
      "notes_paragraphs": 1,
      "objects": [
        {
          "shape_id": 2,
          "name": "rule:u-answer",
          "kind": "shape",
          "editable": true,
          "capability": "editable-shapes",
          "copy_keys": [],
          "fallback": null
        },
        {
          "shape_id": 3,
          "name": "copy:answer#title",
          "kind": "text",
          "editable": true,
          "capability": "text-frame",
          "copy_keys": [
            "answer#title"
          ],
          "fallback": null
        },
        {
          "shape_id": 4,
          "name": "copy:answer#body",
          "kind": "text",
          "editable": true,
          "capability": "text-frame",
          "copy_keys": [
            "answer#body"
          ],
          "fallback": null
        },
        {
          "shape_id": 5,
          "name": "cites:u-answer",
          "kind": "text",
          "editable": true,
          "capability": "text-frame",
          "copy_keys": [],
          "fallback": null
        }
      ]
    },
    {
      "index": 3,
      "part": "ppt/slides/slide3.xml",
      "name": "u-compare",
      "unit": "u-compare",
      "pattern": "comparison",
      "notes_part": "ppt/notesSlides/notesSlide2.xml",
      "notes_paragraphs": 1,
      "objects": [
        {
          "shape_id": 2,
          "name": "rule:today#title",
          "kind": "shape",
          "editable": true,
          "capability": "editable-shapes",
          "copy_keys": [],
          "fallback": null
        },
        {
          "shape_id": 3,
          "name": "copy:today#title",
          "kind": "text",
          "editable": true,
          "capability": "text-frame",
          "copy_keys": [
            "today#title"
          ],
          "fallback": null
        },
        {
          "shape_id": 4,
          "name": "rule:today#body",
          "kind": "shape",
          "editable": true,
          "capability": "editable-shapes",
          "copy_keys": [],
          "fallback": null
        },
        {
          "shape_id": 5,
          "name": "copy:today#body",
          "kind": "text",
          "editable": true,
          "capability": "text-frame",
          "copy_keys": [
            "today#body"
          ],
          "fallback": null
        },
        {
          "shape_id": 6,
          "name": "rule:tomorrow#title",
          "kind": "shape",
          "editable": true,
          "capability": "editable-shapes",
          "copy_keys": [],
          "fallback": null
        },
        {
          "shape_id": 7,
          "name": "copy:tomorrow#title",
          "kind": "text",
          "editable": true,
          "capability": "text-frame",
          "copy_keys": [
            "tomorrow#title"
          ],
          "fallback": null
        },
        {
          "shape_id": 8,
          "name": "rule:tomorrow#body",
          "kind": "shape",
          "editable": true,
          "capability": "editable-shapes",
          "copy_keys": [],
          "fallback": null
        },
        {
          "shape_id": 9,
          "name": "copy:tomorrow#body",
          "kind": "text",
          "editable": true,
          "capability": "text-frame",
          "copy_keys": [
            "tomorrow#body"
          ],
          "fallback": null
        },
        {
          "shape_id": 10,
          "name": "cites:u-compare",
          "kind": "text",
          "editable": true,
          "capability": "text-frame",
          "copy_keys": [],
          "fallback": null
        }
      ]
    },
    {
      "index": 4,
      "part": "ppt/slides/slide4.xml",
      "name": "u-components",
      "unit": "u-components",
      "pattern": "sourced-chart",
      "notes_part": "ppt/notesSlides/notesSlide3.xml",
      "notes_paragraphs": 1,
      "objects": [
        {
          "shape_id": 2,
          "name": "copy:components#title",
          "kind": "text",
          "editable": true,
          "capability": "text-frame",
          "copy_keys": [
            "components#title"
          ],
          "fallback": null
        },
        {
          "shape_id": 3,
          "name": "chart:u-components",
          "kind": "chart",
          "editable": true,
          "capability": "native-chart",
          "copy_keys": [],
          "data_refs": [
            "downtime",
            "wage-premium",
            "insurance-surcharge",
            "compliance-retrofit"
          ],
          "fallback": null
        },
        {
          "shape_id": 4,
          "name": "copy:data:downtime#label",
          "kind": "text",
          "editable": true,
          "capability": "text-frame",
          "copy_keys": [
            "data:downtime#label"
          ],
          "fallback": null
        },
        {
          "shape_id": 5,
          "name": "value:downtime",
          "kind": "text",
          "editable": true,
          "capability": "text-frame",
          "copy_keys": [
            "data:downtime#value"
          ],
          "fallback": null
        },
        {
          "shape_id": 6,
          "name": "copy:data:wage-premium#label",
          "kind": "text",
          "editable": true,
          "capability": "text-frame",
          "copy_keys": [
            "data:wage-premium#label"
          ],
          "fallback": null
        },
        {
          "shape_id": 7,
          "name": "value:wage-premium",
          "kind": "text",
          "editable": true,
          "capability": "text-frame",
          "copy_keys": [
            "data:wage-premium#value"
          ],
          "fallback": null
        },
        {
          "shape_id": 8,
          "name": "copy:data:insurance-surcharge#label",
          "kind": "text",
          "editable": true,
          "capability": "text-frame",
          "copy_keys": [
            "data:insurance-surcharge#label"
          ],
          "fallback": null
        },
        {
          "shape_id": 9,
          "name": "value:insurance-surcharge",
          "kind": "text",
          "editable": true,
          "capability": "text-frame",
          "copy_keys": [
            "data:insurance-surcharge#value"
          ],
          "fallback": null
        },
        {
          "shape_id": 10,
          "name": "copy:data:compliance-retrofit#label",
          "kind": "text",
          "editable": true,
          "capability": "text-frame",
          "copy_keys": [
            "data:compliance-retrofit#label"